place,place_address,station_name,station_address,distance
Almacenes Rodríguez,Calle CABALLERO DE GRACIA 3,Bicipark Canalejas,-,246.15
Antigua Fábrica Martini &amp; Rossi,AVENIDA ARAGON 328,Bicipark Fuente de la Mora,Estación de Fuente de la Mora,7700.55
Ateneo de Madrid,Calle PRADO 21,Bicipark Canalejas,-,283.15
Banco Bilbao Vizcaya Argentaria,Calle ALCALÁ 16,Bicipark Canalejas,-,52.3
Banco de España,Calle ALCALÁ 48,Bicipark Recoletos,"Paseo de Recoletos, 2",348.54
Banco Matritense,Calle GRAN VIA 22,Bicipark Canalejas,-,269.03
Basílica Pontificia de San Miguel,CALLE SAN JUSTO 4,Bicipark Canalejas,-,952.74
Biblioteca Central de la UNED Madrid,CALLE SENDA DEL REY 8,Bicipark Canalejas,-,3208.39
Biblioteca Pública Usera José Hierro,AVENIDA RAFAELA YBARRA 43,Bicipark Canalejas,-,4105.08
Bolsa de Madrid,PLAZA LEALTAD 1,Bicipark Montalban,"Calle de Montalbán, 5",183.77
CaixaForum,PASEO PRADO 36,Bicipark Montalban,"Calle de Montalbán, 5",823.89
Capilla de San Isidro en la Iglesia de San Andrés,PLAZA SAN ANDRES 1,Bicipark Canalejas,-,1153.32
Casa Árabe (antiguas Escuelas Aguirre),CALLE ALCALA 62,Bicipark Montalban,"Calle de Montalbán, 5",836.7
Casa de la Villa,PLAZA VILLA 5,Bicipark Canalejas,-,988.37
Casa de las Alhajas. Antigua Caja de Ahorros,PLAZA SAN MARTIN 1,Bicipark Canalejas,-,636.84
Casa de las Flores,CALLE RODRIGUEZ SAN PEDRO 72,Bicipark Almagro,"Calle Almagro, 11",2012.64
Casa del cura de la iglesia de San José,Calle ALCALÁ ,Bicipark Canalejas,-,265.39
"Casa Sindical (actual sede del Ministerio de Sanidad, Servicios Sociales e Igualdad)",PASEO PRADO 18,Bicipark Montalban,"Calle de Montalbán, 5",562.57
Casino de Madrid,CALLE ALCALA 15,Bicipark Canalejas,-,70.31
Casita Del Príncipe (El Pardo),CALLE ADELINA PATTI 1,Bicipark Pitis,"Calle Pau Arroyo del Fresno, 181",5543.64
Cementerio de la Almudena,AVENIDA DAROCA 94,Bicipark Salamanca,Pl. del Marqués de Salamanca,2824.61
"Central Eléctrica del Pacífico, talleres y oficinas del Metro",CALLE VALDERRIBAS 49,Bicipark Montalban,"Calle de Montalbán, 5",2093.1
Centro Cultural Daoíz y Velarde,PLAZA DAOIZ Y VELARDE 4,Bicipark Montalban,"Calle de Montalbán, 5",2151.02
Centro Cultural La Corrala (sede del Museo de Artes y Tradiciones Populares),CALLE CARLOS ARNICHES 3,Bicipark Canalejas,-,1249.61
Centro del Ejército y la Armada (Casino Militar),Calle CABALLERO DE GRACIA 9,Bicipark Canalejas,-,195.33
Cine Avenida,Calle ABADA 11,Bicipark Canalejas,-,531.21
Cine Callao,Plaza CALLAO 2,Bicipark Canalejas,-,625.58
Cine Gran Vía y Hotel Vincci,Calle GARCIA MOLINAS ,Bicipark Canalejas,-,947.03
Círculo de Bellas Artes,Calle ALCALÁ 42,Bicipark Canalejas,-,252.13
Círculo de la Unión Mercantil e Industrial,Calle GRAN VIA 24,Bicipark Canalejas,-,295.55
Ciudad Universitaria de Madrid,CIUDAD UNIVERSITARIA ,Bicipark Orense,"Avenida General Perón, 27",2730.84
Colegio de Nuestra Señora de Loreto. Madres Ursulinas,CALLE PRINCIPE DE VERGARA 42,Bicipark Salamanca,Pl. del Marqués de Salamanca,251.09
Colegio Mayor Casa do Brasil,AVENIDA ARCO DE LA VICTORIA 3,Bicipark Almagro,"Calle Almagro, 11",2889.95
Colegio Nuestra Señora del Pilar,CALLE CASTELLO 56,Bicipark Salamanca,Pl. del Marqués de Salamanca,281.22
Colegio Oficial de Arquitectos de Madrid,CALLE HORTALEZA 63,Bicipark Villa de Paris,"Calle de Orellana, 23, 21",439.78
Complejo El Águila,CALLE RAMIREZ DE PRADO 3,Bicipark Montalban,"Calle de Montalbán, 5",2028.77
Congreso de los Diputados,Plaza CORTES 1,Bicipark Canalejas,-,288.27
Convento de las Comendadoras y parroquia de Santiago el Mayor,PLAZA COMENDADORAS 10,Bicipark Villa de Paris,"Calle de Orellana, 23, 21",1305.35
Cuartel del Conde Duque,Calle CONDE DUQUE 9,Bicipark Canalejas,-,1459.41
Edificio Bankinter,PASEO CASTELLANA 29,Bicipark Almagro,"Calle Almagro, 11",288.07
Edificio Bankunión (Parlamento Europeo y Embajada de Irlanda),PASEO CASTELLANA 46,Bicipark Almagro,"Calle Almagro, 11",601.84
Edificio Carrión (Capitol),Calle GRAN VIA 41,Bicipark Canalejas,-,682.3
Edificio Coliseum (Teatro Coliseum),CALLE GRAN VIA 78,Bicipark Canalejas,-,1096.93
Edificio de 20 viviendas en calle Cervantes,CALLE CERVANTES 36,Bicipark Canalejas,-,486.12
Edificio de La Unión y el Fénix,Calle GARCIA MOLINAS ,Bicipark Canalejas,-,980.74
Edificio de Los Previsores del Porvenir,Calle CABALLERO DE GRACIA 19,Bicipark Canalejas,-,171.25
Edificio de Oficinas y Apartamentos,Calle GRAN VIA 43,Bicipark Canalejas,-,711.24
Edificio de Viviendas en la calle Hilarión Eslava,CALLE HILARION ESLAVA 10,Bicipark Almagro,"Calle Almagro, 11",2025.46
Edificio Girasol,CALLE LAGASCA 90,Bicipark Salamanca,Pl. del Marqués de Salamanca,468.19
Edificio Gran Peña,Calle GRAN VIA 2,Bicipark Canalejas,-,250.05
Edificio Hostal Lauria,Calle GRAN VIA 50,Bicipark Canalejas,-,692.76
Edificio La Adriática,Plaza CALLAO ,Bicipark Canalejas,-,556.22
Edificio Los Sótanos,Calle GRAN VIA 57,Bicipark Canalejas,-,920.1
Edificio Los Sótanos,Calle GRAN VIA 59,Bicipark Canalejas,-,942.82
Edificio Los Sótanos y Teatro Lope de Vega,Calle GRAN VIA 55,Bicipark Canalejas,-,890.21
Edificio Matesanz,Calle GRAN VIA 27,Bicipark Canalejas,-,362.7
Edificio Metrópolis,CALLE ALCALA 39,Bicipark Canalejas,-,196.49
Edificio para el Banco Urquijo,Calle GRAN VIA 4,Bicipark Canalejas,-,241.06
Edificio Rialto,Calle GRAN VIA 54,Bicipark Canalejas,-,762.35
Edificio Telefónica,CALLE GRAN VIA 28,Bicipark Canalejas,-,346.19
Edificio Vita,Calle GRAN VIA 62,Bicipark Canalejas,-,901.78
Edificio Vitalicio,Plaza ESPAÑA ,Bicipark Canalejas,-,1127.43
Edificio y Cine Pompeya,Calle GRAN VIA 70,Bicipark Canalejas,-,1008.19
Edificios Los Sótanos. Hotel Emperador,Calle GRAN VIA 53,Bicipark Canalejas,-,852.19
Ermita de la Virgen del Puerto,PASEO VIRGEN DEL PUERTO 4,Bicipark Canalejas,-,1852.59
Ermita de San Antonio de la Florida,GLORIETA SAN ANTONIO DE LA FLORIDA 4,Bicipark Canalejas,-,2415.75
Ermita de Santa Maria la Antigua,CALLE MONSE&amp;Ntilde;OR OSCAR ROMERO 92,Bicipark Aviación,Parking Aviación Española,2643.68
Escuelas Pías de San Fernando (Biblioteca  y centro de la UNED),CALLE SOMBRERETE 15,Bicipark Canalejas,-,1138.69
Estación de Atocha,PLAZA EMPERADOR CARLOS V 3,Bicipark Montalban,"Calle de Montalbán, 5",1144.12
Fundación Francisco Giner de los Ríos,PASEO GENERAL MARTINEZ CAMPOS 14,Bicipark Almagro,"Calle Almagro, 11",602.46
Fundación Juan March,CALLE CASTELLO 77,Bicipark Salamanca,Pl. del Marqués de Salamanca,193.68
Gimnasio del Colegio Maravillas,CALLE JOAQUIN COSTA 21,Bicipark Orense,"Avenida General Perón, 27",927.95
Grandes Almacenes Madrid-París,Calle DESENGAÑO 7,Bicipark Canalejas,-,454.27
Hipódromo de la Zarzuela,HIPODROMO ZARZUELA ,Bicipark Pitis,"Calle Pau Arroyo del Fresno, 181",3361.17
Hospital de Jornaleros San Francisco de Paula,CALLE MAUDES 17,Bicipark Orense,"Avenida General Perón, 27",1045.08
Hotel Alfonso XIII,Calle GRAN VIA 34,Bicipark Canalejas,-,496.03
Hotel Apartamentos Espahotel,Calle FLOR BAJA 6,Bicipark Canalejas,-,1039.47
Hotel Gran Vía,Calle GRAN VIA 25,Bicipark Canalejas,-,320.5
Hotel Menfis,Calle GENERAL MITRE ,Bicipark Canalejas,-,1052.0
Hotel Metropolitano,Calle GRAN VIA 23,Bicipark Canalejas,-,300.57
Hotel Nueva York y cine Actualidades,Calle GRAN VIA 48,Bicipark Canalejas,-,668.12
Hotel Palace,PLAZA CORTES 7,Bicipark Canalejas,-,404.78
Hotel Roma,CALLE CLAVEL 3,Bicipark Canalejas,-,243.53
Hotel Washington,Calle GRAN VIA 72,Bicipark Canalejas,-,1031.48
Hotel y cine Rex,Calle GRAN VIA 43B,Bicipark Canalejas,-,725.47
Iglesia de la Concepción Real de Calatrava,Calle ALCALÁ 25,Bicipark Canalejas,-,67.37
Iglesia de San Antonio de los Alemanes,Calle PUEBLA 22,Bicipark Canalejas,-,623.33
Iglesia de San Jerónimo el Real,CALLE MORETO 4,Bicipark Montalban,"Calle de Montalbán, 5",421.96
Iglesia de San José,Calle ALCALÁ 43,Bicipark Canalejas,-,287.22
Iglesia de San Manuel y San Benito,Calle ALCALÁ 83,Bicipark Montalban,"Calle de Montalbán, 5",479.29
Iglesia de San Marcos,CALLE SAN LEONARDO 10,Bicipark Canalejas,-,1256.65
Iglesia de San Pedro el Viejo,Calle NUNCIO 14,Bicipark Canalejas,-,1045.69
Iglesia Parroquial de Santa Ana y Nuestra Señora de la Esperanza,CALLE CAÑADA 35,Bicipark Salamanca,Pl. del Marqués de Salamanca,4003.15
Ilustre Colegio Oficial de Médicos de Madrid,CALLE SANTA ISABEL 51,Bicipark Canalejas,-,1010.79
Instituto Cervantes (antiguo Banco Español del Río de la Plata),Calle ALCALÁ 49,Bicipark Recoletos,"Paseo de Recoletos, 2",278.94
Instituto del Patrimonio Cultural de España,CALLE PINTOR EL GRECO 4,Bicipark Orense,"Avenida General Perón, 27",3735.38
La Casa Encendida,RONDA VALENCIA 2,Bicipark Canalejas,-,1317.44
Matadero y Mercado Municipal de Granados,PASEO CHOPERA 14,Bicipark Canalejas,-,2825.15
Medialab-Prado (antigua Serrería Belga),CALLE ALAMEDA 15,Bicipark Montalban,"Calle de Montalbán, 5",880.05
Mercado de San Miguel,Plaza SAN MIGUEL ,Bicipark Canalejas,-,854.91
"Ministerio de Agricultura, Pesca y Alimentación",PASEO INFANTA ISABEL 1,Bicipark Montalban,"Calle de Montalbán, 5",1057.22
Monasterio de las Descalzas Reales,Plaza DESCALZAS ,Bicipark Canalejas,-,559.43
Monasterio de Montserrat,CALLE SAN BERNARDO 79,Bicipark Villa de Paris,"Calle de Orellana, 23, 21",1109.21
Museo Cerralbo,CALLE VENTURA RODRIGUEZ 17,Bicipark Canalejas,-,1444.12
Museo de América,AVENIDA REYES CATOLICOS 6,Bicipark Almagro,"Calle Almagro, 11",2593.03
Museo de Historia de Madrid. Museo Municipal de Madrid,CALLE FUENCARRAL 78,Bicipark Villa de Paris,"Calle de Orellana, 23, 21",612.07
Museo del Ferrocarril,PASEO DELICIAS 1,Bicipark Montalban,"Calle de Montalbán, 5",1254.48
Museo Lázaro Galdiano,CALLE SERRANO 122,Bicipark Almagro,"Calle Almagro, 11",909.35
Museo Nacional Centro de Arte Reina Sofía,CALLE SANTA ISABEL 52,Bicipark Montalban,"Calle de Montalbán, 5",1090.41
Museo Nacional de Ciencias Naturales y Escuela Técnica Superior de Ingenieros Industriales,CALLE JOSE GUTIERREZ ABASCAL 2,Bicipark Almagro,"Calle Almagro, 11",1141.71
Museo Nacional del Prado,PASEO PRADO 1,Bicipark Montalban,"Calle de Montalbán, 5",158.47
Museo Sorolla,Paseo GENERAL MARTINEZ CAMPOS 37,Bicipark Almagro,"Calle Almagro, 11",569.33
Museo Thyssen-Bornemisza (Palacio de Vistahermosa),PASEO PRADO 8,Bicipark Montalban,"Calle de Montalbán, 5",409.92
Nuevos Ministerios,CALLE AGUSTIN DE BETANCOURT 4,Bicipark Orense,"Avenida General Perón, 27",1145.18
Observatorio Astronómico,CALLE ALFONSO XII 3,Bicipark Montalban,"Calle de Montalbán, 5",980.24
Oficinas para Ramón López-Rumayor Lombera,Calle CONCEPCION ARENAL 1,Bicipark Canalejas,-,555.72
Oficinas para Vicente Patuel,Calle CHINCHILLA 9,Bicipark Canalejas,-,435.59
Oratorio del Caballero de Gracia,Calle CABALLERO DE GRACIA 5,Bicipark Fuente de la Mora,Estación de Fuente de la Mora,
Palacio de Altamira (Instituto Europeo del Diseño),Calle FLOR ALTA 8,Bicipark Canalejas,-,796.23
Palacio de Amboage (actual sede de la Embajada de Italia),CALLE LAGASCA 98,Bicipark Salamanca,Pl. del Marqués de Salamanca,497.21
Palacio de Biblioteca y Museos Nacionales,CALLE SERRANO 13,Bicipark Recoletos,"Paseo de Recoletos, 2",459.41
Palacio de Buena Vista (actual sede del Cuartel General del Ejército de Tierra),Calle ALCALÁ 51,Bicipark Recoletos,"Paseo de Recoletos, 2",196.31
"Palacio de Comunicaciones (Palacio de Cibeles, Ayuntamiento de Madrid)",PLAZA CIBELES 1,Bicipark Recoletos,"Paseo de Recoletos, 2",148.12
Palacio de Fernán Nuñez (Fundación de los Ferrocarriles Españoles),CALLE SANTA ISABEL 44,Bicipark Canalejas,-,908.4
Palacio de la Música,Calle ABADA 14,Bicipark Canalejas,-,497.9
Palacio de la Prensa,PLAZA CALLAO 4,Bicipark Canalejas,-,561.01
Palacio de Linares (actual Casa de América),PLAZA CIBELES 1,Bicipark Recoletos,"Paseo de Recoletos, 2",148.12
Palacio de Liria,CALLE PRINCESA 20,Bicipark Canalejas,-,1501.34
Palacio de Longoria (sede de la Sociedad General de Autores y Editores),Calle FERNANDO VI 4,Bicipark Villa de Paris,"Calle de Orellana, 23, 21",269.66
Palacio de los Duques de Santoña (Cámara de Comercio),Calle HUERTAS 13,Bicipark Canalejas,-,421.0
Palacio de Santa Cruz (sede actual del Ministerio de Asuntos Exteriores),PLAZA PROVINCIA 1,Bicipark Canalejas,-,643.48
Palacio del Duque de Uceda o Palacio de Consejos,CALLE MAYOR 79,Bicipark Canalejas,-,1183.55
Palacio del Marqués de Salamanca,Paseo RECOLETOS 10,Bicipark Recoletos,"Paseo de Recoletos, 2",158.04
Palacio del Marqués de Perales (Filmoteca Española),CALLE MAGDALENA 10,Bicipark Canalejas,-,651.92
Palacio Real de El Pardo,CALLE MANUEL ALONSO 1,Bicipark Pitis,"Calle Pau Arroyo del Fresno, 181",5167.06
Palacio Real de Madrid,Calle BAILEN ,Bicipark Canalejas,-,1258.22
Parque de El Retiro,PLAZA INDEPENDENCIA 7,Bicipark Montalban,"Calle de Montalbán, 5",296.63
Parroquia de Nuestra Señora del Tránsito,CARRETERA CANILLAS 40,Bicipark Recuerdo,"Calle Hiedra, 26",2612.07
Parroquia de San Pedro Advincula,CALLE SIERRA GORDA 5,Bicipark Montalban,"Calle de Montalbán, 5",7303.87
Parroquia de San Pedro de los Dominicos,AVENIDA BURGOS 204,Bicipark Fuente de la Mora,Estación de Fuente de la Mora,1981.38
Parroquia de Santa Bárbara,CALLE GENERAL CASTA&amp;Ntilde;OS 2,Bicipark Villa de Paris,"Calle de Orellana, 23, 21",149.71
Parroquia Nuestra Señora de Guadalupe,CALLE PUERTO RICO 1,Bicipark Orense,"Avenida General Perón, 27",1627.44
Parroquia San Millán y San Cayetano,Calle EMBAJADORES 15,Bicipark Canalejas,-,1046.28
Plaza de Toros de Las Ventas,Calle ALCALÁ 237,Bicipark Salamanca,Pl. del Marqués de Salamanca,1351.69
Plaza Mayor,Plaza MAYOR ,Bicipark Canalejas,-,723.27
Puerta del Sol,PLAZA PUERTA DEL SOL 1,Bicipark Canalejas,-,258.86
Real Academia de Bellas Artes de San Fernando,Calle ALCALÁ 13,Bicipark Canalejas,-,117.34
Real Academia de la Historia,CALLE LEON 21,Bicipark Canalejas,-,483.0
Real Academia Española de la Lengua,CALLE FELIPE IV 4,Bicipark Montalban,"Calle de Montalbán, 5",341.27
Real Basílica de San Francisco el Grande,Gran Vía SAN FRANCISCO 19,Bicipark Canalejas,-,1531.23
Real Casa de Correos,PLAZA PUERTA DEL SOL 7,Bicipark Canalejas,-,393.76
Real Casa de la Aduana (actual sede del Ministerio de Hacienda),CALLE ALCALA 5,Bicipark Canalejas,-,207.57
Real Colegiata de San Isidro,CALLE TOLEDO 37,Bicipark Canalejas,-,859.46
Real Jardín Botánico,PLAZA MURILLO 2,Bicipark Montalban,"Calle de Montalbán, 5",648.7
Real Monasterio de la Encarnación,Plaza ENCARNACION 1,Bicipark Canalejas,-,1075.07
Reforma del antiguo edificio de Unión Eléctrica,CALLE GRAN VIA 4,Bicipark Canalejas,-,225.77
Residencia de Estudiantes,CALLE PINAR 21,Bicipark Almagro,"Calle Almagro, 11",1215.63
Restos del Antiguo Palacio del Buen Retiro,CALLE FELIPE IV 1,Bicipark Montalban,"Calle de Montalbán, 5",342.05
Salón del Prado,Paseo PRADO ,Bicipark Montalban,"Calle de Montalbán, 5",419.59
Teatro Barceló,CALLE BARCELO 11,Bicipark Villa de Paris,"Calle de Orellana, 23, 21",535.79
Teatro María Guerrero,Calle TAMAYO Y BAUS 4,Bicipark Recoletos,"Paseo de Recoletos, 2",282.88
Teatro Real,PLAZA ISABEL II ,Bicipark Canalejas,-,824.35
Teatro Valle-Inclán,CALLE VALENCIA 1,Bicipark Canalejas,-,1092.7
Templo de Debod,CALLE FERRAZ 1,Bicipark Canalejas,-,1596.34
Terminal T4,AEROPUERTO TERMINAL T-4 ,Bicipark Fuente de la Mora,Estación de Fuente de la Mora,6085.41
Torre Castelar,PASEO CASTELLANA 50,Bicipark Almagro,"Calle Almagro, 11",677.2
Torre de Madrid,PLAZA ESPAÑA 18,Bicipark Canalejas,-,1303.47
Torres Blancas,AVENIDA AMERICA 37,Bicipark Salamanca,Pl. del Marqués de Salamanca,1209.65
Tribunal Superior de Justicia,CALLE GENERAL CASTA&amp;Ntilde;OS 1,Bicipark Villa de Paris,"Calle de Orellana, 23, 21",111.26
Viaducto,CALLE BAILEN 12,Bicipark Canalejas,-,1259.42
Viviendas para Alejandro Santamaría,Calle GRAN VIA 56,Bicipark Canalejas,-,792.72
Viviendas para el Conde Artaza,Calle CABALLERO DE GRACIA 11,Bicipark Canalejas,-,178.13
Viviendas para el conde de Godó,Calle GRAN VIA 44,Bicipark Canalejas,-,593.78
Viviendas para el Marqués de Cubas y Fontalba,Calle GONZALO JIMENEZ DE QUESADA 2,Bicipark Canalejas,-,410.21
Viviendas para el Marqués de Cubas y Fontalba,Calle GRAN VIA 30,Bicipark Canalejas,-,380.05
Viviendas para el marqués de Falces,Calle CONCEPCION ARENAL 2,Bicipark Canalejas,-,526.46
Viviendas para el marqués de Urquijo,Calle GRAN VIA 6,Bicipark Canalejas,-,231.44
Viviendas para el marqués de Villamayor de Santiago,Calle CABALLERO DE GRACIA 7,Bicipark Canalejas,-,212.44
Viviendas para Fernando M. Vidales,Calle GRAN VIA 52,Bicipark Canalejas,-,724.22
Viviendas para José María Escriña,Calle GRAN VIA 69,Bicipark Canalejas,-,1092.22
Viviendas para José Pérez Pla,Calle FLOR BAJA 4,Bicipark Canalejas,-,1018.91
Viviendas para Juan Giralt de la Porta,Calle CABALLERO DE GRACIA 17,Bicipark Canalejas,-,169.14
Viviendas para la Sociedad Inmobiliaria de la Villa de Madrid. Bar Chicote.,Calle GRAN VIA 12,Bicipark Canalejas,-,223.93
Viviendas para la Sociedad Inmobiliaria de Madrid,Calle GRAN VIA 14,Bicipark Canalejas,-,227.69
Viviendas para Luis Ocharán Mazas,Calle CABALLERO DE GRACIA 21,Bicipark Canalejas,-,181.63
Viviendas para Luis y Manuel Mitjans,Calle CABALLERO DE GRACIA 13,Bicipark Canalejas,-,170.36
Viviendas para María Monasterio Arrillaga,Calle GRAN VIA 36,Bicipark Canalejas,-,509.02
Viviendas para Seguros La Estrella,Calle GRAN VIA 20,Bicipark Canalejas,-,260.57
Viviendas para Seguros La Estrella,Calle GRAN VIA 10,Bicipark Canalejas,-,222.48
Viviendas para Tomás Allende,Calle CABALLERO DE GRACIA 1,Bicipark Canalejas,-,262.27
Viviendas y comercio para Rafael Sánchez,Calle CLAVEL 4,Bicipark Fuente de la Mora,Estación de Fuente de la Mora,
Viviendas y comercios para Francisco Escriña,Calle GRAN VIA 71,Bicipark Canalejas,-,1109.38
Viviendas y oficinas,Calle GRAN VIA 45,Bicipark Canalejas,-,754.56
Viviendas y oficinas,Calle GRAN VIA 80,Bicipark Canalejas,-,1117.07
Viviendas y oficinas,Calle GRAN VIA 51,Bicipark Canalejas,-,806.55
Viviendas y oficinas,Calle GRAN VIA 60,Bicipark Canalejas,-,879.67
Viviendas y oficinas para el vizconde de Escoriaza,Calle GRAN VIA 22B,Bicipark Canalejas,-,278.36
Viviendas y oficinas para Hilario Ruiz,Calle DOCTOR CARRACIDO ,Bicipark Canalejas,-,1061.4
Viviendas y oficinas para Jesús de Murga,Calle FUENCARRAL 2,Bicipark Canalejas,-,312.01
Viviendas y oficinas para Jesús Ussia y Cubas y Cine Azul,Calle GENERAL MITRE ,Bicipark Canalejas,-,1083.12
Viviendas y oficinas para José María Cano,Calle GRAN VIA 42,Bicipark Canalejas,-,572.19
Viviendas y oficinas para José María de Antonio Becerril,Calle GRAN VIA 8,Bicipark Canalejas,-,222.16
Viviendas y oficinas para José Pérez Pla,Calle GRAN VIA 64,Bicipark Canalejas,-,920.62
Viviendas y oficinas para Juan Miralles Sesé,Calle FLOR BAJA 2,Bicipark Canalejas,-,995.11
Viviendas y oficinas para la Constructora Calpense,Calle CHINCHILLA ,Bicipark Canalejas,-,397.63
Viviendas y oficinas para Leopoldo García,Calle GRAN VIA 49,Bicipark Canalejas,-,788.17
Viviendas y oficinas para Rafael Calabuig,Calle GRAN VIA 58,Bicipark Canalejas,-,858.66
Viviendas y oficinas para Ramón Saiz de Carlos,Calle GRAN VIA 33,Bicipark Canalejas,-,473.43
Viviendas y oficinas para Santos Suárez y Compañía,Calle GRAN VIA 47,Bicipark Canalejas,-,771.06
Viviendas y oficinas para Seguros La Estrella,Calle CABALLERO DE GRACIA 15,Bicipark Canalejas,-,168.25
Viviendas y teatro Fontalba para el marqués de Cubas y Fontalba,Calle DESENGAÑO 3,Bicipark Canalejas,-,397.21
Zoo Aquarium de Madrid,COMPLEJO ZOOLOGICO DE LA CASA CAMPO ,Bicipark Aviación,Parking Aviación Española,3668.5
